opiniones,Sentimiento
"El producto es excelente, me encantó.",Positivo
Muy buen servicio y atención.,Positivo
Todo llegó perfecto y antes del tiempo estimado.,Positivo
Recomiendo completamente esta tienda.,Positivo
"Funciona muy bien, supera mis expectativas.",Positivo
"Muy mala calidad, no lo recomiendo.",Negativo
Me llegó roto y tarde.,Negativo
La atención al cliente fue pésima.,Negativo
Producto incompleto y mal embalado.,Negativo
"No vale lo que cuesta, decepcionante.",Negativo
"El producto funciona, pero no es nada especial.",Neutro
"Cumple con lo prometido, sin más.",Neutro
"Regular, no fue lo que esperaba, pero tampoco fue malo.",Neutro
La calidad es aceptable por el precio.,Neutro
"Ni bueno ni malo, simplemente correcto.",Neutro
"Llega en el tiempo esperado, pero el empaque es simple.",Neutro
"No está mal, pero podría mejorar.",Neutro
"Es justo lo que esperaba, sin sorpresas.",Neutro
"Servicio estándar, no tengo quejas.",Neutro
"Cumplió con lo básico, nada destacable.",Neutro
